{
  "schema_version": "stage_definition.v1",
  "stage_id": "racecourse_complex_stage",
  "display_name": "赛马场综合区",
  "scene_path": "scenes/tracen-racecourse-complex/scene.json",
  "actors": [
    {
      "instance_id": "trainer",
      "bundle_id": "trainer",
      "spawn_id": "racecourse_start",
      "control_owner": "player",
      "player": true
    },
    {
      "instance_id": "uma_admire_vega",
      "bundle_id": "admire-vega-uniform",
      "spawn_id": "from_academy_gate",
      "control_owner": "agent",
      "player": false
    }
  ]
}
