{
  "schema_version": "stage_definition.v1",
  "stage_id": "academic_rooms_stage",
  "display_name": "教学楼房间层",
  "scene_path": "scenes/tracen-academic-rooms/scene.json",
  "actors": [
    {
      "instance_id": "trainer",
      "bundle_id": "trainer",
      "spawn_id": "from_main_school_library",
      "control_owner": "player",
      "player": true
    },
    {
      "instance_id": "uma_admire_vega",
      "bundle_id": "admire-vega-uniform",
      "spawn_id": "from_main_school_classroom",
      "control_owner": "agent",
      "player": false
    }
  ]
}
