{
  "schema_version": "stage_definition.v1",
  "stage_id": "observatory_stage",
  "display_name": "海岬观景台",
  "scene_path": "scenes/tracen-observatory/scene.json",
  "actors": [
    {
      "instance_id": "trainer",
      "bundle_id": "trainer",
      "spawn_id": "observatory_start",
      "control_owner": "player",
      "player": true
    },
    {
      "instance_id": "uma_admire_vega",
      "bundle_id": "admire-vega-uniform",
      "spawn_id": "from_beach",
      "control_owner": "agent",
      "player": false
    }
  ]
}
