{
  "schema_version": "stage_definition.v1",
  "stage_id": "main_school_interior_stage",
  "display_name": "主校舍内部",
  "scene_path": "scenes/tracen-main-school-interior/scene.json",
  "actors": [
    {
      "instance_id": "trainer",
      "bundle_id": "trainer",
      "spawn_id": "entrance_hall_start",
      "control_owner": "player",
      "player": true
    },
    {
      "instance_id": "uma_admire_vega",
      "bundle_id": "admire-vega-uniform",
      "spawn_id": "from_school_courtyard",
      "control_owner": "agent",
      "player": false
    }
  ]
}
