{
  "schema_version": "stage_definition.v1",
  "stage_id": "dormitory_life_stage",
  "display_name": "宿舍生活区",
  "scene_path": "scenes/tracen-dormitory-life/scene.json",
  "actors": [
    {
      "instance_id": "trainer",
      "bundle_id": "trainer",
      "spawn_id": "from_student_plaza",
      "control_owner": "player",
      "player": true
    },
    {
      "instance_id": "uma_admire_vega",
      "bundle_id": "admire-vega-uniform",
      "spawn_id": "from_academy_gate",
      "control_owner": "agent",
      "player": false
    }
  ]
}
