{
  "schema_version": "stage_definition.v1",
  "stage_id": "shrine_stage",
  "display_name": "山麓神社",
  "scene_path": "scenes/tracen-shrine/scene.json",
  "actors": [
    {
      "instance_id": "trainer",
      "bundle_id": "trainer",
      "spawn_id": "shrine_start",
      "control_owner": "player",
      "player": true
    },
    {
      "instance_id": "uma_admire_vega",
      "bundle_id": "admire-vega-uniform",
      "spawn_id": "from_commercial_street",
      "control_owner": "agent",
      "player": false
    }
  ]
}
