{
  "schema_version": "stage_definition.v1",
  "stage_id": "trainer_office_stage",
  "display_name": "训练员室",
  "scene_path": "scenes/tracen-trainer-office/scene.json",
  "actors": [
    {
      "instance_id": "trainer",
      "bundle_id": "trainer",
      "spawn_id": "trainer_office_start",
      "control_owner": "player",
      "player": true
    },
    {
      "instance_id": "uma_admire_vega",
      "bundle_id": "admire-vega-uniform",
      "spawn_id": "from_main_school",
      "control_owner": "agent",
      "player": false
    }
  ]
}
