{
  "schema_version": "stage_definition.v1",
  "stage_id": "riverside_path_stage",
  "display_name": "河边步道",
  "scene_path": "scenes/tracen-riverside-path/scene.json",
  "actors": [
    {
      "instance_id": "trainer",
      "bundle_id": "trainer",
      "spawn_id": "riverside_start",
      "control_owner": "player",
      "player": true
    },
    {
      "instance_id": "uma_admire_vega",
      "bundle_id": "admire-vega-uniform",
      "spawn_id": "from_academy_gate",
      "control_owner": "agent",
      "player": false
    }
  ]
}
